{
  "$schema": "http://json-schema.org/draft-07/schema#",
  "title": "ZAP Checkpoint Message (v0.1)",
  "type": "object",
  "additionalProperties": false,
  "required": [
    "zap",
    "type",
    "id",
    "ts",
    "missionId",
    "kind"
  ],
  "properties": {
    "zap": {
      "type": "string",
      "enum": [
        "0.1"
      ],
      "description": "ZAP protocol version (0.1 = the v0 slice of issue #809)"
    },
    "type": {
      "type": "string",
      "enum": [
        "checkpoint"
      ]
    },
    "id": {
      "type": "string",
      "minLength": 1,
      "description": "Unique message id (host: UUID v4)"
    },
    "ts": {
      "type": "string",
      "pattern": "^\\d{4}-\\d{2}-\\d{2}T\\d{2}:\\d{2}:\\d{2}(\\.\\d+)?Z$",
      "description": "ISO-8601 UTC with Z suffix"
    },
    "missionId": {
      "type": "string",
      "minLength": 1
    },
    "kind": {
      "type": "string",
      "enum": [
        "save",
        "restore",
        "saved",
        "restored"
      ]
    },
    "stateId": {
      "type": "string",
      "minLength": 1,
      "description": "Required for restore; host-generated for save"
    },
    "digest": {
      "type": "string",
      "pattern": "^[a-f0-9]{64}$",
      "description": "sha256 of the canonical snapshot (saved/restored replies)"
    },
    "steps": {
      "type": "integer",
      "minimum": 0,
      "description": "Evidence count at snapshot time"
    },
    "at": {
      "type": "string",
      "pattern": "^\\d{4}-\\d{2}-\\d{2}T\\d{2}:\\d{2}:\\d{2}(\\.\\d+)?Z$"
    }
  }
}
